{"account_id":"892077329800","cleanup_id":"lease-contention-cleanup-010","deletion":{"attempted":true,"return_code":0,"stderr_sha256":"e3b0c44298fc1c149afbf4c8996fb92427ae41e4649b934ca495991b7852b855","stdout_sha256":"05fbd7046859f611bafb83d05caf349d1a3fe0a7833b339a924c53df651f7cdd","succeeded":true},"expected_owner":"lease-contention-009-worker-03","failure_reason":null,"final":{"item_absent":true,"table_count":0},"gates":{"delete_succeeded":true,"exact_item_bound":true,"final_absent":true,"identity_bound":true,"no_retries":true,"no_scientific_action":true},"identity_arn":"arn:aws:iam::892077329800:root","input_lock_sha256":null,"lease_key":"runs/preparation/lease-contention-009-20260802-4c8d1e","no_scientific_action":true,"plan_sha256":"eb9f6ea9c938effc4604a4705d955e25ba9827efe64bc95fbd2eba7fcf343e2a","preflight":{"action_id_exact":true,"item_present":true,"owner_exact":true,"table_active":true,"table_arn_exact":true},"provider":"aws","record_kind":"cloud_lease_contention_cleanup_receipt","region":"us-east-1","residual_resource_ids":[],"schema_version":"0.1.0","table_arn":"arn:aws:dynamodb:us-east-1:892077329800:table/pneuma-c160-leases","table_name":"pneuma-c160-leases","target_action_id":"lease-contention-009","verdict":"passed"}
